{
  "$schema": "http://json-schema.org/draft-07/schema#",
  "$id": "https://seven332.github.io/codex-marketplace/schemas/plugin.schema.json",
  "title": "Codex Plugin Manifest",
  "type": "object",
  "required": [
    "name",
    "version",
    "description",
    "author",
    "license",
    "skills",
    "interface"
  ],
  "additionalProperties": true,
  "properties": {
    "name": {
      "type": "string",
      "pattern": "^[a-z0-9][a-z0-9-]*$"
    },
    "version": {
      "type": "string",
      "pattern": "^[0-9]+\\.[0-9]+\\.[0-9]+(?:[-+][0-9A-Za-z.-]+)?$"
    },
    "description": {
      "type": "string",
      "minLength": 1
    },
    "author": {
      "type": "object",
      "required": [
        "name"
      ],
      "additionalProperties": true,
      "properties": {
        "name": {
          "type": "string",
          "minLength": 1
        }
      }
    },
    "license": {
      "type": "string",
      "minLength": 1
    },
    "keywords": {
      "type": "array",
      "items": {
        "type": "string",
        "minLength": 1
      },
      "uniqueItems": true
    },
    "skills": {
      "type": "string",
      "pattern": "^\\./.+"
    },
    "interface": {
      "type": "object",
      "required": [
        "displayName",
        "shortDescription",
        "longDescription",
        "developerName",
        "category",
        "capabilities",
        "defaultPrompt",
        "brandColor",
        "screenshots"
      ],
      "additionalProperties": true,
      "properties": {
        "displayName": {
          "type": "string",
          "minLength": 1
        },
        "shortDescription": {
          "type": "string",
          "minLength": 1
        },
        "longDescription": {
          "type": "string",
          "minLength": 1
        },
        "developerName": {
          "type": "string",
          "minLength": 1
        },
        "category": {
          "type": "string",
          "minLength": 1
        },
        "capabilities": {
          "type": "array",
          "minItems": 1,
          "items": {
            "type": "string",
            "minLength": 1
          }
        },
        "defaultPrompt": {
          "type": "array",
          "minItems": 1,
          "items": {
            "type": "string",
            "minLength": 1
          }
        },
        "brandColor": {
          "type": "string",
          "pattern": "^#[0-9A-Fa-f]{6}$"
        },
        "screenshots": {
          "type": "array",
          "items": {
            "type": "string",
            "minLength": 1
          }
        }
      }
    }
  }
}
